{
  "signoff_version": "1.0.0",
  "generated_at": "2026-07-14T01:21:32.122981Z",
  "mode": "final_business_signoff",
  "ready_for_execution": false,
  "ready_for_write_to_main_pipeline": false,
  "source_file_hashes": {
    "final_write_plan_items_json": "d8038a0330f0e50761f081e423c67dc9bef0d93d7addad309d5b676f4d353b77",
    "approval_chain_status_json": "5e0607e16ea60ce620bbf6f1d327931265113d35cbbb6b949eca8c9cd9bbde65"
  },
  "summary": {
    "total_signoff_items": 3,
    "approved_count": 3,
    "pending_count": 0,
    "rejected_count": 0,
    "proposed_status": "FINAL_BUSINESS_SIGNOFF_APPROVED"
  },
  "signoff_items": [
    {
      "signoff_item_id": "SIGNOFF_ITEM_0001",
      "final_plan_item_id": "PLAN_ITEM_0001",
      "write_candidate_id": "WRITE_CANDIDATE_0001",
      "supplier_code": "CHINT",
      "material_code": "NXM-63S",
      "normalized_description": "MCCB Chint NXM-63S 3P 25÷63 25",
      "unit": "cái",
      "quantity": 1.0,
      "unit_price": 800000,
      "amount": 800000.0,
      "currency": "VND",
      "planned_action": "PLAN_INSERT",
      "risk_level": "LOW",
      "provenance": "Source PDF: Bảng giá Chint 1-3-2023 ck 50.pdf, Page: 3, Layout: chint_mccb_nxm_nm1, Method: coordinate_column_profiler",
      "evidence_text": "25÷63 25 NXM-63S 800,000",
      "master_match_result": null,
      "human_decision": "APPROVE_FOR_EXECUTOR_DESIGN",
      "human_note": "Approved by Project Owner for executor design only; no real write authorization.",
      "reviewed_by": "Project Owner",
      "reviewed_at": "2026-07-14T01:20:58Z",
      "decision_required": true
    },
    {
      "signoff_item_id": "SIGNOFF_ITEM_0002",
      "final_plan_item_id": "PLAN_ITEM_0002",
      "write_candidate_id": "WRITE_CANDIDATE_0002",
      "supplier_code": "CHINT",
      "material_code": "NXM-125S",
      "normalized_description": "MCCB Chint NXM-125S 3P 80÷125 25",
      "unit": "cái",
      "quantity": 1.0,
      "unit_price": 860000,
      "amount": 860000.0,
      "currency": "VND",
      "planned_action": "PLAN_INSERT",
      "risk_level": "LOW",
      "provenance": "Source PDF: Bảng giá Chint 1-3-2023 ck 50.pdf, Page: 3, Layout: chint_mccb_nxm_nm1, Method: coordinate_column_profiler",
      "evidence_text": "80 ÷ 125 25 NXM-125S 860,000",
      "master_match_result": null,
      "human_decision": "APPROVE_FOR_EXECUTOR_DESIGN",
      "human_note": "Approved by Project Owner for executor design only; no real write authorization.",
      "reviewed_by": "Project Owner",
      "reviewed_at": "2026-07-14T01:20:58Z",
      "decision_required": true
    },
    {
      "signoff_item_id": "SIGNOFF_ITEM_0003",
      "final_plan_item_id": "PLAN_ITEM_0003",
      "write_candidate_id": "WRITE_CANDIDATE_0003",
      "supplier_code": "CHINT",
      "material_code": "NXM-250S",
      "normalized_description": "MCCB Chint NXM-250S 3P 160,200,250 35",
      "unit": "cái",
      "quantity": 1.0,
      "unit_price": 1400000,
      "amount": 1400000.0,
      "currency": "VND",
      "planned_action": "PLAN_INSERT",
      "risk_level": "LOW",
      "provenance": "Source PDF: Bảng giá Chint 1-3-2023 ck 50.pdf, Page: 3, Layout: chint_mccb_nxm_nm1, Method: coordinate_column_profiler",
      "evidence_text": "160,200,250 35 NXM-250S 1,400,000",
      "master_match_result": null,
      "human_decision": "APPROVE_FOR_EXECUTOR_DESIGN",
      "human_note": "Approved by Project Owner for executor design only; no real write authorization.",
      "reviewed_by": "Project Owner",
      "reviewed_at": "2026-07-14T01:20:58Z",
      "decision_required": true
    }
  ]
}
